{
  "job_id": "unity-roadmap-intern-3-months",
  "title": "LEVEL UP: UNITY ROADMAP",
  "brand_pack": "sun-studio",
  "inputs": [
    {
      "path": "input/Prompt.md",
      "role": "mixed",
      "checksum": "48fb72080a24c04eee3b0a48a935e1d61df52d3d7c4f7a75cdd50d600e10fb50"
    }
  ],
  "authority": {
    "content": "input/Prompt.md is the sole content source. Preserve the Vietnamese roadmap structure and slide count.",
    "appearance": "User prompt specifies a modern dark-mode neon training deck; SUN.STUDIO brand pack supplies local fonts, logo, Dio character, and published diagram/card resources."
  },
  "exports": ["html"],
  "editability": {
    "text": true,
    "foreground_shapes": true,
    "backgrounds": "hybrid"
  },
  "visual_needs": [
    "Dark neon game UI cover with Unity/gamepad motif",
    "Three-month horizontal roadmap timeline",
    "Month 1 four-week badge training grid",
    "Month 2 cross-functional workflow and weekly milestones",
    "Month 3 ownership staircase progression",
    "Profile cards for mentor, GD, artist, QA, PM and HR",
    "Minimal Q&A and thank-you closing slides"
  ],
  "fonts": [
    "Proxima Nova local canonical font",
    "Space Grotesk / Lexend style fallback via system sans-serif stack",
    "Inter / DM Sans style fallback via system sans-serif stack"
  ],
  "effects": [
    "high-contrast neon accents",
    "soft CSS glow",
    "subtle grid texture",
    "CSS-only isometric objects and icon masks"
  ],
  "unsupported_effects": [
    "No real Unity 3D model asset is provided; cover uses local Unity/gamepad iconography and CSS isometric geometry instead."
  ],
  "required_tools": ["node", "python"],
  "approvals": [
    "Approve dark-neon visual direction as an intentional appearance override from the default light SUN.STUDIO look.",
    "Approve HTML as the requested first delivery format; PPTX/PDF can be generated as a follow-up if needed."
  ],
  "overrides": []
}